{
  "titre": "Désinflation achevée, cycle mature — Fed en pause, BCE divergente, risque de ralentissement 2026",
  "phase_cycle": "pic",
  "politique_monetaire": "neutre",
  "tendance_inflation": "stabilisation",
  "score_risque": 6,
  "analyse": "## Contexte macroéconomique\n\nLes États-Unis se situent en phase de **pic de cycle** caractérisée par une stabilisation inflationniste et un marché du travail encore résilient mais en refroidissement progressif. Le **CPI à 2,83% YoY** (janvier 2026) confirme l'achèvement de la désinflation amorcée depuis 2022 — le taux est désormais proche de la cible des 2% de la Fed, contre 3,4% un an auparavant. Le **chômage à 4,3%** reste modéré mais a augmenté de 0,1pp sur un mois, signalant un relâchement du marché du travail compatible avec un cycle mature. Le **spread 10Y-2Y à 0,61%** (février 2026), bien que positif, demeure comprimé et historiquement bas — il ne signale plus une inversion imminente mais reflète une courbe plate, typique d'une phase de transition vers la contraction. En zone euro, la **BCE maintient son taux directeur à 2,15%**, soit **1,49pp au-dessous de la Fed**, creusant un différentiel de taux qui soutient le dollar. L'**EUR/USD à 1,164** reste affaibli, pénalisant les exportateurs européens et révélant une divergence de politique monétaire persistante.\n\n## Enjeux clés\n\n**Politique monétaire comparée : Fed en pause, BCE en attente**\n\nLa **Fed Funds à 3,64%** combinée à un **CPI core probablement autour de 3,0-3,2%** (le headline à 2,83% suggère un core légèrement supérieur) implique un **taux réel de ~0,6-0,8%**, demeurant restrictif mais non agressif. La Fed a cessé ses hausses et maintient une pause depuis plusieurs mois — le **bilan en contraction (-8,987 Mrd$ en février)** confirme la poursuite du QT (quantitative tightening) à rythme modéré. La BCE, confrontée à une inflation plus basse en zone euro et à une croissance molle, a amorcé son cycle de baisse (taux à 2,15% vs 3,64% à la Fed). Ce **différentiel de 149 points de base** alimente les flux de capitaux vers les actifs américains et maintient le dollar fort (**Dollar Index broad à 117,53**, quasi-stable). Les marchés anticipent une première baisse Fed au printemps 2026 si l'inflation reste stable — chaque donnée CPI devient critique.\n\n**Dynamique inflationniste : stabilisation, non désinflation**\n\nLe **CPI headline à 2,83% YoY** marque un plateau après 18 mois de baisse régulière. L'absence de données core détaillées limite l'analyse, mais le headline suggère que les services (composante core dominante) se sont stabilisés autour de 3,0-3,2%, tandis que les biens (plus volatiles) oscillent. Cette stabilisation à proximité de la cible des 2% est positive pour la Fed — elle valide la stratégie restrictive — mais elle implique aussi que les marges de baisse supplémentaires sont limitées. Les anticipations d'inflation à long terme (5-10 ans) restent ancrées autour de 2,3-2,5% selon les enquêtes, ce qui soutient la crédibilité de la Fed. En zone euro, l'inflation est probablement plus basse (données non fournies), justifiant la divergence de politique.\n\n**Liquidité et conditions financières : détente progressive**\n\nLa **M2 à 22,411 Trillions $ (+88,9 Mrd$ en décembre)** affiche une croissance modérée et stable après les chocs de 2023-2024 — la masse monétaire s'est normalisée. Le **bilan Fed en contraction** (-8,987 Mrd$ en février) poursuit le QT à un rythme d'environ 60 Mrd$/mois, conforme aux annonces. Le **taux hypothécaire 30 ans à 6,01%** (-0,08pp en une semaine) signale une détente des conditions de crédit — les rendements obligataires se stabilisent et les spreads de crédit (non fournis) sont probablement stables. L'absence de données VIX et de spreads de crédit limite l'analyse du stress financier, mais l'absence de volatilité extrême est un signal neutre à positif.\n\n## Risques & Opportunités\n\n**Risques**\n\n- **Courbe des taux plate et risque de contraction** : le spread 10Y-2Y à 0,61% est historiquement bas et positif, mais une nouvelle inversion (si les taux courts remontent ou les longs baissent) signalerait une récession probable dans 6-12 mois. Le **Treasury 10 ans à 4,09%** est stable, mais une hausse au-delà de 4,3% compresserait davantage la courbe.\n- **Dollar fort et vulnérabilité des émergents** : le **Dollar Index à 117,53** pénalise les économies endettées en dollars et ralentit les exportations américaines. Une poursuite de la force du dollar (si la Fed maintient des taux élevés plus longtemps que prévu) risque de freiner la croissance mondiale et les bénéfices des multinationales US.\n- **Chômage en hausse progressive** : le passage de 4,2% à 4,3% en un mois est mineur, mais si cette tendance s'accélère (vers 4,5-4,7%), elle signalerait un ralentissement du marché du travail compatible avec une contraction. Les données d'emploi non-agricoles (non fournies) seront décisives.\n- **Divergence BCE-Fed non résolue** : la BCE ne peut pas baisser aussi vite que la Fed sans risquer une dépréciation excessive de l'euro et une importation d'inflation. Cette impasse alimente les tensions commerciales potentielles et pèse sur la croissance européenne.\n\n**Opportunités**\n\n- **Stabilisation inflationniste ouvre la voie à des baisses de taux** : si le CPI core reste sous 3,2% et le headline sous 3,0% dans les 2-3 prochains mois, la Fed pourrait entamer un cycle de baisse dès avril-mai 2026, soutenant les actifs de risque et réduisant les coûts de financement.\n- **Détente des conditions de crédit** : la baisse du taux hypothécaire (-0,08pp en une semaine) et la stabilité de M2 suggèrent que le crédit commence à se détendre — les PME et les ménages pourraient bénéficier de conditions moins restrictives, soutenant la croissance.\n\n## Perspectives\n\nLes **deux prochaines semaines** seront dominées par les données d'emploi (nonfarm payrolls, taux de chômage) et les indices d'activité (ISM services, ISM manufacturing) attendus mi-mars. **Seuil critique** : si les créations d'emploi passent sous 150k/mois ou si l'ISM services tombe sous 50 (contraction), cela accélèrerait les anticipations de baisse Fed et ferait baisser les rendements obligataires. Inversement, un rapport d'emploi fort (>250k) ou un ISM >52 repousserait les baisses à mai-juin.\n\nLe **CPI de mars** (publié mi-avril) sera décisif : un headline sous 2,8% ou un core sous 3,1% validerait la trajectoire de stabilisation et ouvrirait la voie à une première baisse Fed en mai. Un rebond au-delà de 3,0% headline forcerait la Fed à maintenir sa pause plus longtemps.\n\nEn zone euro, la **BCE pourrait baisser à nouveau en mars** si l'inflation reste basse — cela creuserait davantage le différentiel de taux et maintiendrait le dollar fort. **Scénario haussier** : désinflation plus rapide que prévu (CPI <2,7%) + emploi faible = baisses Fed rapides + détente des spreads. **Scénario baissier** : inflation collante (CPI >3,0%) + emploi résilient = Fed en pause prolongée + rendements obligataires stables/haussiers.",
  "indicateurs_cles": [
    {
      "nom": "CPI (headline)",
      "valeur": "2,83% YoY",
      "signal": "neutre",
      "commentaire": "Stabilisation après désinflation de 18 mois. Proche de la cible des 2% mais pas encore atteinte. Baisse de 0,57pp vs janvier 2025 (3,40%), confirmant la trajectoire de normalisation. Absence de données core limite l'analyse, mais le headline suggère un core autour de 3,0-3,2%."
    },
    {
      "nom": "Fed Funds Rate",
      "valeur": "3,64%",
      "signal": "neutre",
      "commentaire": "Inchangé depuis plusieurs mois. Taux réel (~0,8% avec CPI à 2,83%) demeure restrictif mais non agressif. La Fed est en pause, attendant la confirmation de la stabilisation inflationniste avant d'entamer des baisses."
    },
    {
      "nom": "Spread 10Y-2Y",
      "valeur": "0,61%",
      "signal": "baissier",
      "commentaire": "Positif mais historiquement comprimé. Indique une courbe plate, typique d'un pic de cycle. Pas d'inversion imminente, mais peu de pente — signal de transition vers contraction si la courbe s'inverse dans les 2-3 prochains mois."
    },
    {
      "nom": "Chômage",
      "valeur": "4,3%",
      "signal": "neutre",
      "commentaire": "Hausse de 0,1pp en un mois (vs 4,2% en décembre 2025). Reste modéré historiquement, mais la tendance haussière est compatible avec un relâchement du marché du travail en phase de pic. À surveiller : accélération vers 4,5-4,7% signalerait contraction."
    },
    {
      "nom": "Treasury 10 ans",
      "valeur": "4,09%",
      "signal": "neutre",
      "commentaire": "Stable (+0,04pp en une semaine). Reflète l'équilibre entre attentes de baisses Fed et demande obligataire. Seuil clé : au-delà de 4,3%, compresserait davantage la courbe et signalerait une hausse des anticipations d'inflation."
    },
    {
      "nom": "Dollar Index (broad)",
      "valeur": "117,53",
      "signal": "haussier",
      "commentaire": "Quasi-stable (-0,01 en une semaine). Reste à des niveaux élevés, soutenu par le différentiel de taux Fed-BCE (149 bps). Force du dollar pénalise les émergents et ralentit les exportations US — risque si elle persiste."
    },
    {
      "nom": "M2",
      "valeur": "22,411 Trillions $",
      "signal": "neutre",
      "commentaire": "Croissance modérée (+88,9 Mrd$ en décembre). Masse monétaire normalisée après chocs 2023-2024. Stabilité compatible avec une politique neutre et absence de stress de liquidité."
    },
    {
      "nom": "Bilan Fed",
      "valeur": "6,613 Trillions $",
      "signal": "baissier",
      "commentaire": "En contraction (-8,987 Mrd$ en février). QT poursuivi à rythme modéré (~60 Mrd$/mois). Retrait progressif de la liquidité, compatible avec une phase de normalisation post-crise."
    },
    {
      "nom": "Taux hypothécaire 30 ans",
      "valeur": "6,01%",
      "signal": "haussier",
      "commentaire": "Baisse de 0,08pp en une semaine. Détente des conditions de crédit — signal positif pour le marché immobilier et les ménages. À confirmer si la tendance persiste."
    },
    {
      "nom": "EUR/USD",
      "valeur": "1,164",
      "signal": "baissier",
      "commentaire": "Euro affaibli, soutenu par le différentiel de taux Fed-BCE. Pénalise les exportateurs européens et reflète la divergence de politique monétaire. Seuil clé : sous 1,15 signalerait une pression accrue sur l'euro."
    }
  ],
  "perspectives": "**Données à surveiller (1-2 prochaines semaines)** : rapport d'emploi US (nonfarm payrolls, taux de chômage) et ISM services/manufacturing (mi-mars). **Seuils critiques** : créations d'emploi <150k/mois ou ISM services <50 accélèreraient les anticipations de baisse Fed et feraient baisser les rendements obligataires de 20-30 bps. Inversement, >250k ou ISM >52 repousserait les baisses à mai-juin. **CPI de mars** (publié mi-avril) sera décisif : headline <2,8% ou core <3,1% validerait la stabilisation et ouvrirait la voie à une première baisse Fed en mai. **Scénario haussier** : désinflation rapide + emploi faible = baisses Fed accélérées, détente des spreads, dollar affaibli, actifs de risque soutenus. **Scénario baissier** : inflation collante (>3,0%) + emploi résilient = Fed en pause prolongée, rendements stables/haussiers, dollar fort, contraction du crédit. **Zone euro** : BCE pourrait baisser en mars, creusant le différentiel de taux et maintenant le dollar fort — risque pour les émergents et multinationales US.",
  "updated": "2026-02-20T07:30:14.153Z",
  "source": "Claude IA + FRED + BCE + commodités",
  "indicators_count": 10,
  "extra_sources": 2
}